{
  "name": "azure-us-gov-topsecret",
  "displayName": "Azure Government Top Secret (operator supplied example)",
  "environment": "usgovernmenttopsecret",
  "authorityHost": "https://login.topsecret.contoso.internal/",
  "resourceManagerEndpoint": "https://management.topsecret.contoso.internal/",
  "resourceManagerAudience": "https://management.topsecret.contoso.internal/",
  "tenantId": "00000000-0000-0000-0000-000000000000",
  "serviceDnsSuffixes": {
    "storage": ".blob.core.topsecret.contoso.internal",
    "keyVault": ".vault.topsecret.contoso.internal",
    "sqlServer": ".database.topsecret.contoso.internal",
    "containerRegistry": ".azurecr.topsecret.contoso.internal"
  },
  "serviceAudiences": {
    "arm": "https://management.topsecret.contoso.internal/",
    "storage": "https://storage.topsecret.contoso.internal/",
    "keyVault": "https://vault.topsecret.contoso.internal/"
  },
  "notes": "Replace every placeholder host with your Top Secret environment's approved management endpoint and audience values."
}
