{
  "name": "azure-us-gov-secret",
  "displayName": "Azure Government Secret (operator supplied example)",
  "environment": "usgovernmentsecret",
  "authorityHost": "https://login.secret.contoso.internal/",
  "resourceManagerEndpoint": "https://management.secret.contoso.internal/",
  "resourceManagerAudience": "https://management.secret.contoso.internal/",
  "tenantId": "00000000-0000-0000-0000-000000000000",
  "serviceDnsSuffixes": {
    "storage": ".blob.core.secret.contoso.internal",
    "keyVault": ".vault.secret.contoso.internal",
    "sqlServer": ".database.secret.contoso.internal",
    "containerRegistry": ".azurecr.secret.contoso.internal"
  },
  "serviceAudiences": {
    "arm": "https://management.secret.contoso.internal/",
    "storage": "https://storage.secret.contoso.internal/",
    "keyVault": "https://vault.secret.contoso.internal/"
  },
  "notes": "Replace every placeholder host with the exact Secret cloud endpoints and audiences used in your enclave."
}
