{
  "name": "azure-commercial",
  "displayName": "Azure Commercial (Public)",
  "environment": "public",
  "authorityHost": "https://login.microsoftonline.com/",
  "resourceManagerEndpoint": "https://management.azure.com/",
  "resourceManagerAudience": "https://management.azure.com/",
  "serviceDnsSuffixes": {
    "storage": ".blob.core.windows.net",
    "keyVault": ".vault.azure.net",
    "sqlServer": ".database.windows.net",
    "containerRegistry": ".azurecr.io"
  },
  "serviceAudiences": {
    "arm": "https://management.azure.com/",
    "storage": "https://storage.azure.com/",
    "keyVault": "https://vault.azure.net/"
  },
  "portalUrl": "https://portal.azure.com/",
  "notes": "Azure Commercial (Public) cloud defaults. Use for development and non-government workloads."
}
